{
  "pair_id": "cement_spy",
  "schema_version": "1.0.0",
  "last_updated_at": "2026-10-16T18:26:20.256704+00:00",
  "suggestions": [
    {
      "signal_name": "Lead-durability & revision robustness",
      "proposed_by": "evan",
      "source": "FRED",
      "observation": "The selected rule uses an L8 lead on chg_6m; the growth signal is leading, but adjacent-lead durability and the winner's direction-vs-prior should be checked.",
      "rationale": "The series is revised, so a long lead needs adjacent-lead durability and a COVID-excluded robustness check before it is trusted.",
      "possible_use_case": "robustness check",
      "caveats": "Search-selected rule; the long lead is likely a fitting artifact and needs final-exam validation.",
      "date_filed": "2026-10-16"
    }
  ],
  "notes": "Generated with the Portland Cement Shipments x SPY pair pipeline."
}
